{
  "schema_version": 2,
  "skill": "security-ai-generated-code-auditor",
  "source": {
    "repository": "https://github.com/msitarzewski/agency-agents.git",
    "revision": "3c9588880b7cafaec325a104899fd8bbe27e7d72",
    "imported_at": "2026-08-27",
    "provenance_type": "import-isolate",
    "handoff": {
      "case_id": "20260827-203823_agency-agents-remaining-safe-skills-v2_22858806",
      "artifact": "security-ai-generated-code-auditor",
      "artifact_sha256": "e1089d0a6b5000cfab8814bd22f18494681aa6cb77087c7f729c85056ca0dffd"
    },
    "adopted_content_sha256": "ce2ca6e46b616bd72b5dc80d6198c68e21e54e4ccd8c1f66f39814b753d60417"
  },
  "license": {
    "identifier": "MIT",
    "reviewed": true
  },
  "risk": {
    "tier": 0,
    "capabilities": {
      "lifecycle_hooks": false,
      "network": false,
      "credentials": false,
      "external_mutations": false,
      "runtime_installation": false,
      "remote_mcp": false,
      "git_publication": false,
      "deployment": false,
      "deletion": false
    }
  },
  "filesystem": {
    "read": [],
    "write": [],
    "absolute_paths": false
  },
  "activation": {
    "mode": "model",
    "requires_trusted_project": true,
    "requires_human_approval": false
  },
  "dependencies": {
    "locked": true,
    "runtime_installation": false
  },
  "approval": {
    "status": "approved",
    "reviewer": "repository-owner",
    "reviewed_at": "2026-09-01"
  },
  "rollback": {
    "verified": true,
    "method": "Remove only skills/security-ai-generated-code-auditor from the accepted catalogue source, run the repository-owned workspace catalogue synchronization, and regenerate discovery state."
  }
}
