{
  "schema_version": 2,
  "skill": "security-architect",
  "source": {
    "repository": "https://github.com/msitarzewski/agency-agents.git",
    "revision": "3c9588880b7cafaec325a104899fd8bbe27e7d72",
    "imported_at": "2026-08-27",
    "provenance_type": "import-isolate",
    "handoff": {
      "case_id": "20260827-193408_agency-agents-kis-safe-skills-final_b87fb68f",
      "artifact": "security-architect",
      "artifact_sha256": "9bed22f1563679d6fc567d903a2bf499f77b725a5827f03ef827103f0305979c"
    },
    "adopted_content_sha256": "2b5b3791af40568781e80bd5fb3e7eebad29bfba882344b5660f053c42e4d114"
  },
  "license": {
    "identifier": "MIT",
    "reviewed": true
  },
  "risk": {
    "tier": 0,
    "capabilities": {
      "lifecycle_hooks": false,
      "network": false,
      "credentials": false,
      "external_mutations": false,
      "runtime_installation": false,
      "remote_mcp": false,
      "git_publication": false,
      "deployment": false,
      "deletion": false
    }
  },
  "filesystem": {
    "read": [],
    "write": [],
    "absolute_paths": false
  },
  "activation": {
    "mode": "model",
    "requires_trusted_project": true,
    "requires_human_approval": false
  },
  "dependencies": {
    "locked": true,
    "runtime_installation": false
  },
  "approval": {
    "status": "approved",
    "reviewer": "repository-owner",
    "reviewed_at": "2026-09-01"
  },
  "rollback": {
    "verified": true,
    "method": "Remove only skills/security-architect from the accepted catalogue source, run the repository-owned workspace catalogue synchronization, and regenerate discovery state."
  }
}
