{
  "schema_version": 2,
  "skill": "engineering-code-reviewer",
  "source": {
    "repository": "https://github.com/msitarzewski/agency-agents.git",
    "revision": "3c9588880b7cafaec325a104899fd8bbe27e7d72",
    "imported_at": "2026-08-27",
    "provenance_type": "import-isolate",
    "handoff": {
      "case_id": "20260827-193408_agency-agents-kis-safe-skills-final_b87fb68f",
      "artifact": "code-reviewer",
      "artifact_sha256": "f18d6b8cddbb5fd9de91ed4d5f1e270e0994852b5aa20fc537085d196ad93403"
    },
    "adopted_content_sha256": "eab8815c39aec8566fe47339301022df1479cc62ea2d10d8ac424b615e6969e4"
  },
  "license": {
    "identifier": "MIT",
    "reviewed": true
  },
  "risk": {
    "tier": 0,
    "capabilities": {
      "lifecycle_hooks": false,
      "network": false,
      "credentials": false,
      "external_mutations": false,
      "runtime_installation": false,
      "remote_mcp": false,
      "git_publication": false,
      "deployment": false,
      "deletion": false
    }
  },
  "filesystem": {
    "read": [],
    "write": [],
    "absolute_paths": false
  },
  "activation": {
    "mode": "model",
    "requires_trusted_project": true,
    "requires_human_approval": false
  },
  "dependencies": {
    "locked": true,
    "runtime_installation": false
  },
  "approval": {
    "status": "approved",
    "reviewer": "repository-owner",
    "reviewed_at": "2026-09-01"
  },
  "rollback": {
    "verified": true,
    "method": "Remove only skills/engineering-code-reviewer from the accepted catalogue source, run the repository-owned workspace catalogue synchronization, and regenerate discovery state."
  }
}
