{
  "schema_version": 2,
  "skill": "evidence-collector",
  "source": {
    "repository": "https://github.com/msitarzewski/agency-agents",
    "revision": "3c9588880b7cafaec325a104899fd8bbe27e7d72",
    "imported_at": "2026-08-27",
    "provenance_type": "import-isolate",
    "handoff": {
      "case_id": "20260827-193408_agency-agents-kis-safe-skills-final_b87fb68f",
      "artifact": "evidence-collector",
      "artifact_sha256": "7b130867cebbc6db57881798819a6762602fabaa5929a800a7ba635de138e1b3"
    },
    "adopted_content_sha256": "83b59a76f421589069344c163ccb429f095ed1805dfb60e6c3578e7c88aece94"
  },
  "license": {
    "identifier": "MIT",
    "reviewed": true
  },
  "risk": {
    "tier": 0,
    "capabilities": {
      "lifecycle_hooks": false,
      "network": false,
      "credentials": false,
      "external_mutations": false,
      "runtime_installation": false,
      "remote_mcp": false,
      "git_publication": false,
      "deployment": false,
      "deletion": false
    }
  },
  "filesystem": {
    "read": [],
    "write": [],
    "absolute_paths": false
  },
  "activation": {
    "mode": "model",
    "requires_trusted_project": true,
    "requires_human_approval": false
  },
  "dependencies": {
    "locked": true,
    "runtime_installation": false
  },
  "approval": {
    "status": "approved",
    "reviewer": "repository-owner",
    "reviewed_at": "2026-08-28"
  },
  "rollback": {
    "verified": true,
    "method": "Remove only the skills/evidence-collector package from the accepted catalogue source, then run the repository-owned workspace catalogue synchronization and regenerate discovery state."
  }
}
