{
  "schema_version": 2,
  "skill": "engineering-minimal-change-engineer",
  "source": {
    "repository": "https://github.com/msitarzewski/agency-agents.git",
    "revision": "3c9588880b7cafaec325a104899fd8bbe27e7d72",
    "imported_at": "2026-08-27",
    "provenance_type": "import-isolate",
    "handoff": {
      "case_id": "20260827-193408_agency-agents-kis-safe-skills-final_b87fb68f",
      "artifact": "minimal-change-engineer",
      "artifact_sha256": "335dc2c882a4cbfe6940d2ffd856b1ac491c0df5fbc05f42e1264a7e6b0620b7"
    },
    "adopted_content_sha256": "586d419647320fe9aad6533488212eae94f3159c58f3bfd40b431d3656fec847"
  },
  "license": {
    "identifier": "MIT",
    "reviewed": true
  },
  "risk": {
    "tier": 0,
    "capabilities": {
      "lifecycle_hooks": false,
      "network": false,
      "credentials": false,
      "external_mutations": false,
      "runtime_installation": false,
      "remote_mcp": false,
      "git_publication": false,
      "deployment": false,
      "deletion": false
    }
  },
  "filesystem": {
    "read": [],
    "write": [],
    "absolute_paths": false
  },
  "activation": {
    "mode": "model",
    "requires_trusted_project": true,
    "requires_human_approval": false
  },
  "dependencies": {
    "locked": true,
    "runtime_installation": false
  },
  "approval": {
    "status": "approved",
    "reviewer": "repository-owner",
    "reviewed_at": "2026-09-01"
  },
  "rollback": {
    "verified": true,
    "method": "Remove only skills/engineering-minimal-change-engineer from the accepted catalogue source, run the repository-owned workspace catalogue synchronization, and regenerate discovery state."
  }
}
