{
  "schema_version": 2,
  "skill": "explorer",
  "source": {
    "repository": "https://github.com/NielPieterse0/chatgpt-skill.git",
    "revision": "d839d3fb4f7933f4dd5a4d9aa3c1c064be232534",
    "imported_at": "2026-08-16",
    "provenance_type": "trusted-local",
    "handoff": null,
    "adopted_content_sha256": "31cbc568659f88cf46a7db4ee3c3575a457ea2494ef9d58c912c4ca0be88bab2"
  },
  "license": {
    "identifier": "Apache-2.0",
    "reviewed": true
  },
  "risk": {
    "tier": 0,
    "capabilities": {
      "lifecycle_hooks": false,
      "network": false,
      "credentials": false,
      "external_mutations": false,
      "runtime_installation": false,
      "remote_mcp": false,
      "git_publication": false,
      "deployment": false,
      "deletion": false
    }
  },
  "filesystem": {
    "read": [],
    "write": [],
    "absolute_paths": false
  },
  "activation": {
    "mode": "model",
    "requires_trusted_project": true,
    "requires_human_approval": false
  },
  "dependencies": {
    "locked": true,
    "runtime_installation": false
  },
  "approval": {
    "status": "approved",
    "reviewer": "repository-owner",
    "reviewed_at": "2026-09-01"
  },
  "rollback": {
    "verified": true,
    "method": "Remove only skills/explorer from the accepted catalogue source, run the repository-owned workspace catalogue synchronization, and regenerate discovery state."
  }
}
