{
  "schema_version": 2,
  "skill": "receiving-code-review",
  "source": {
    "repository": "https://github.com/obra/superpowers",
    "revision": "a1cbc2e46d5c2709c5827fe28296a8dbcb972509e71cb3f2567295377d6f0430",
    "imported_at": "2026-08-26",
    "provenance_type": "trusted-local",
    "handoff": null,
    "adopted_content_sha256": "ec59c2454634efaa3a5f9d25241e16704ff89f69a2d063ef73baa66c6751bfd6"
  },
  "license": {
    "identifier": "MIT",
    "reviewed": true
  },
  "risk": {
    "tier": 1,
    "capabilities": {
      "lifecycle_hooks": false,
      "network": false,
      "credentials": false,
      "external_mutations": false,
      "runtime_installation": false,
      "remote_mcp": false,
      "git_publication": false,
      "deployment": false,
      "deletion": false
    }
  },
  "filesystem": {
    "read": [
      "."
    ],
    "write": [],
    "absolute_paths": false
  },
  "activation": {
    "mode": "model",
    "requires_trusted_project": true,
    "requires_human_approval": false
  },
  "dependencies": {
    "locked": true,
    "runtime_installation": false
  },
  "approval": {
    "status": "approved",
    "reviewer": "repository-owner",
    "reviewed_at": "2026-08-26"
  },
  "rollback": {
    "verified": true,
    "method": "Remove skills/receiving-code-review from accepted repository state, regenerate the catalogue, and republish through the controlled catalogue synchronizer."
  }
}
